{"$id":"https://single-image-studio.invalid/research/slice-11/schemas/capability-contract.slice11.v0.schema.json","$schema":"https://json-schema.org/draft/2020-12/schema","additionalProperties":false,"properties":{"candidateRef":{"additionalProperties":false,"properties":{"byteLength":{"minimum":1,"type":"integer"},"contentHash":{"pattern":"^[a-f0-9]{64}$","type":"string"},"fileSha256":{"pattern":"^[a-f0-9]{64}$","type":"string"},"id":{"pattern":"^[A-Za-z0-9][A-Za-z0-9._:@/-]{2,199}$","type":"string"},"path":{"maxLength":200000,"minLength":1,"type":"string"}},"required":["path","id","contentHash","byteLength","fileSha256"],"type":"object"},"contentHash":{"pattern":"^[a-f0-9]{64}$","type":"string"},"evidenceBoundary":{"additionalProperties":false,"properties":{"c1":{"const":0},"e1":{"const":0},"formalEvidence":{"const":false},"g1":{"const":0},"o1":{"const":0},"productSupport":{"const":false},"r1Pipeline":{"const":0},"r1ProductRelease":{"const":0},"r1ProductValidation":{"const":0},"releaseAllowlist":{"const":"none"},"releaseApproved":{"const":0},"releaseRegistered":{"const":0},"u1":{"const":0},"v1":{"const":0}},"required":["c1","e1","formalEvidence","g1","o1","productSupport","r1Pipeline","r1ProductRelease","r1ProductValidation","releaseAllowlist","releaseApproved","releaseRegistered","u1","v1"],"type":"object"},"fallback":{"const":false},"frozenAt":{"format":"date-time","type":"string"},"id":{"pattern":"^[A-Za-z0-9][A-Za-z0-9._:@/-]{2,199}$","type":"string"},"maxDimension":{"const":256},"maxOutputBytes":{"const":1048576},"operation":{"enum":["normalize","export"]},"oracleRepair":{"const":false},"outputProfile":{"const":"canonical-png-IHDR-sRGB-IDAT-IEND-filter0"},"passthrough":{"const":false},"priorContractRef":{"additionalProperties":false,"properties":{"byteLength":{"minimum":1,"type":"integer"},"contentHash":{"pattern":"^[a-f0-9]{64}$","type":"string"},"fileSha256":{"pattern":"^[a-f0-9]{64}$","type":"string"},"id":{"pattern":"^[A-Za-z0-9][A-Za-z0-9._:@/-]{2,199}$","type":"string"},"path":{"maxLength":200000,"minLength":1,"type":"string"}},"required":["path","id","contentHash","byteLength","fileSha256"],"type":"object"},"productSupport":{"const":false},"schemaVersion":{"const":"capability-contract.slice11.v0"},"semanticDeltaFromSlice10":{"const":"none-image-semantics-protocol-only"}},"required":["schemaVersion","id","operation","candidateRef","priorContractRef","semanticDeltaFromSlice10","outputProfile","maxDimension","maxOutputBytes","passthrough","fallback","oracleRepair","productSupport","frozenAt","evidenceBoundary","contentHash"],"type":"object"}
