{"candidateRef":{"byteLength":3006,"contentHash":"7591599cd4f19883fe6d3f7f7fb3ae81aa54eddfa2a9607c7b04d2c40ffa2183","fileSha256":"570bb70690657269693200e4fb7bccc8efdc0adcb84633cbf4065f6f0432f2f1","id":"REG-NORM-SHARP-CANONICAL-PNG@0.11.0","path":"candidate-locks/canonical-png.v0.11.0.json"},"contentHash":"df42ccc62581dcba9b686b3cc93714d83e83879f0befd9d505229f2a7ec620a4","evidenceBoundary":{"c1":0,"e1":0,"formalEvidence":false,"g1":0,"o1":0,"productSupport":false,"r1Pipeline":0,"r1ProductRelease":0,"r1ProductValidation":0,"releaseAllowlist":"none","releaseApproved":0,"releaseRegistered":0,"u1":0,"v1":0},"fallback":false,"frozenAt":"2026-08-15T23:01:50.529Z","id":"CC-CAP02-NORMALIZE-PNG@0.11.0","maxDimension":256,"maxOutputBytes":1048576,"operation":"normalize","oracleRepair":false,"outputProfile":"canonical-png-IHDR-sRGB-IDAT-IEND-filter0","passthrough":false,"priorContractRef":{"byteLength":1297,"contentHash":"1b8fc81ca3c985e0d0de7831c3804b34673e87387093d352572e172a45087f0b","fileSha256":"5d2c8791652798c39ecf1cf45ed2f21959866f33600840acf690478d5756c2f1","id":"CC-CAP02-NORMALIZE-PNG@0.10.0","path":"research/slice-10/contracts/cc-cap02-normalize-png.v0.10.0.json"},"productSupport":false,"schemaVersion":"capability-contract.slice11.v0","semanticDeltaFromSlice10":"none-image-semantics-protocol-only"}
